{
    "$schema": "https://json-schema.org/draft/2020-12/schema",
    "$id": "https://raw.githubusercontent.com/omeka-s-contrib/omeka-s-blueprints/main/assets/schema/blueprint-schema.json",
    "title": "Omeka S Blueprint",
    "description": "Declarative description of an Omeka S environment.",
    "type": "object",
    "additionalProperties": false,
    "properties": {
        "$schema": { "type": "string" },
        "meta": {
            "type": "object",
            "description": "Human-readable metadata.",
            "additionalProperties": false,
            "properties": {
                "title": { "type": "string" },
                "author": { "type": "string" },
                "description": { "type": "string" }
            }
        },
        "preferredVersions": {
            "type": "object",
            "description": "Informational runtime targets.",
            "additionalProperties": false,
            "properties": {
                "php": { "type": "string" },
                "omeka": { "type": "string" }
            }
        },
        "siteOptions": {
            "type": "object",
            "description": "Install-wide defaults, applied at core install time.",
            "additionalProperties": false,
            "properties": {
                "title": { "type": "string" },
                "locale": { "type": "string" },
                "timezone": { "type": "string" }
            }
        },
        "modules": { "$ref": "#/$defs/moduleList" },
        "themes": { "$ref": "#/$defs/themeList" },
        "vocabularies": { "$ref": "#/$defs/vocabularyList" },
        "resourceTemplates": { "$ref": "#/$defs/resourceTemplateList" },
        "settings": { "$ref": "#/$defs/settings" },
        "users": { "$ref": "#/$defs/userList" },
        "itemSets": { "$ref": "#/$defs/itemSetList" },
        "items": { "$ref": "#/$defs/itemList" },
        "site": { "$ref": "#/$defs/site" },
        "sites": { "type": "array", "items": { "$ref": "#/$defs/site" } },

        "debug": {
            "type": "object",
            "additionalProperties": false,
            "properties": {
                "enabled": { "type": "boolean" }
            }
        },
        "phpConstants": {
            "type": "object",
            "description": "PHP constants to define before Omeka boots, mapping constant name to value.",
            "propertyNames": { "pattern": "^[A-Z_][A-Z0-9_]*$" },
            "additionalProperties": { "type": ["boolean", "string", "number"] }
        },
        "login": {
            "type": "object",
            "additionalProperties": false,
            "properties": {
                "email": { "type": "string", "format": "email" },
                "password": { "type": "string", "minLength": 1 }
            }
        },
        "landingPage": { "type": "string" }
    },

    "$defs": {
        "reference": {
            "type": "object",
            "description": "A pointer to an external file or URL whose contents are spliced into the enclosing list. The referenced document is itself a valid list (or single item) for that key.",
            "additionalProperties": false,
            "required": ["$import"],
            "properties": {
                "$import": { "type": "string", "minLength": 1 }
            }
        },

        "moduleId": {
            "type": "string",
            "description": "Omeka S module identifier (equal to the module's directory name).",
            "pattern": "^[A-Za-z0-9][A-Za-z0-9_-]*$"
        },
        "moduleSource": {
            "oneOf": [
                {
                    "type": "object",
                    "additionalProperties": false,
                    "required": ["type"],
                    "properties": { "type": { "const": "bundled" } }
                },
                {
                    "type": "object",
                    "additionalProperties": false,
                    "required": ["type", "url"],
                    "properties": {
                        "type": { "const": "url" },
                        "url": { "type": "string", "format": "uri-reference" }
                    }
                },
                {
                    "type": "object",
                    "additionalProperties": false,
                    "required": ["type"],
                    "properties": {
                        "type": { "const": "omeka.org" },
                        "slug": { "type": "string", "minLength": 1 }
                    }
                }
            ]
        },
        "module": {
            "type": "object",
            "additionalProperties": false,
            "required": ["name"],
            "properties": {
                "name": { "$ref": "#/$defs/moduleId" },
                "state": {
                    "type": "string",
                    "description": "download = place files only; install = install; activate = install and enable.",
                    "enum": ["download", "install", "activate"]
                },
                "version": { "type": "string" },
                "source": { "$ref": "#/$defs/moduleSource" },
                "assets": {
                    "type": "array",
                    "description": "Extra ZIP payloads overlaid onto the installed module directory after the module is extracted. Each archive is unpacked into 'destination' (relative to the module root); a single top-level wrapper folder is stripped, mirroring module extraction.",
                    "items": {
                        "type": "object",
                        "additionalProperties": false,
                        "required": ["url", "destination"],
                        "properties": {
                            "url": { "type": "string", "format": "uri-reference" },
                            "destination": { "type": "string", "minLength": 1 }
                        }
                    }
                }
            }
        },
        "moduleList": {
            "type": "array",
            "items": {
                "oneOf": [
                    { "$ref": "#/$defs/moduleId" },
                    { "$ref": "#/$defs/module" },
                    { "$ref": "#/$defs/reference" }
                ]
            }
        },

        "themeId": {
            "type": "string",
            "description": "Omeka S theme identifier (equal to the theme's directory name).",
            "pattern": "^[A-Za-z0-9][A-Za-z0-9_-]*$"
        },
        "themeSource": { "$ref": "#/$defs/moduleSource" },
        "theme": {
            "type": "object",
            "additionalProperties": false,
            "required": ["name"],
            "properties": {
                "name": { "$ref": "#/$defs/themeId" },
                "version": { "type": "string" },
                "source": { "$ref": "#/$defs/themeSource" }
            }
        },
        "themeList": {
            "type": "array",
            "items": {
                "oneOf": [
                    { "$ref": "#/$defs/themeId" },
                    { "$ref": "#/$defs/theme" },
                    { "$ref": "#/$defs/reference" }
                ]
            }
        },

        "vocabulary": {
            "type": "object",
            "description": "A vocabulary to import via the RDF importer. Provide exactly one RDF source (url or file) plus the identifying fields.",
            "additionalProperties": false,
            "required": ["namespaceUri", "prefix", "label"],
            "oneOf": [
                { "required": ["url"] },
                { "required": ["file"] }
            ],
            "properties": {
                "url": { "type": "string", "format": "uri-reference" },
                "file": { "type": "string" },
                "namespaceUri": { "type": "string" },
                "prefix": { "type": "string" },
                "label": { "type": "string" },
                "comment": { "type": "string" },
                "format": { "type": "string" },
                "lang": { "type": "string" },
                "labelProperty": { "type": "string", "description": "RDF property to use for labels." },
                "commentProperty": { "type": "string", "description": "RDF property to use for comments." }
            }
        },
        "vocabularyList": {
            "type": "array",
            "items": {
                "oneOf": [
                    { "$ref": "#/$defs/vocabulary" },
                    { "$ref": "#/$defs/reference" }
                ]
            }
        },

        "resourceTemplate": {
            "type": "object",
            "additionalProperties": false,
            "required": ["source"],
            "properties": {
                "source": {
                    "type": "string",
                    "description": "Path or URL to a resource-template JSON export."
                },
                "label": { "type": "string" },
                "ignoreDeps": { "type": "boolean" }
            }
        },
        "resourceTemplateList": {
            "type": "array",
            "items": {
                "oneOf": [
                    { "$ref": "#/$defs/resourceTemplate" },
                    { "$ref": "#/$defs/reference" }
                ]
            }
        },

        "settingsMap": {
            "type": "object",
            "description": "A map of global setting id => value.",
            "additionalProperties": true
        },
        "settings": {
            "description": "Global settings. Either an inline map, or a list of maps/references merged in order.",
            "oneOf": [
                {
                    "allOf": [
                        { "$ref": "#/$defs/settingsMap" },
                        { "not": { "required": ["$import"] } }
                    ]
                },
                {
                    "type": "array",
                    "items": {
                        "oneOf": [
                            {
                                "allOf": [
                                    { "$ref": "#/$defs/settingsMap" },
                                    { "not": { "required": ["$import"] } }
                                ]
                            },
                            { "$ref": "#/$defs/reference" }
                        ]
                    }
                }
            ]
        },

        "user": {
            "type": "object",
            "additionalProperties": false,
            "required": ["email"],
            "properties": {
                "email": { "type": "string", "format": "email" },
                "username": { "type": "string" },
                "password": { "type": "string", "minLength": 1 },
                "role": {
                    "type": "string",
                    "minLength": 1,
                    "description": "Omeka S role id. Core roles: global_admin, site_admin, editor, reviewer, author, researcher. Modules can register more (e.g. guest)."
                },
                "isActive": { "type": "boolean" },
                "settings": {
                    "type": "object",
                    "description": "Per-user settings written to user_setting (e.g. limit_to_granted_sites).",
                    "additionalProperties": true
                }
            }
        },
        "userList": {
            "type": "array",
            "items": {
                "oneOf": [
                    { "$ref": "#/$defs/user" },
                    { "$ref": "#/$defs/reference" }
                ]
            }
        },

        "itemSet": {
            "type": "object",
            "additionalProperties": false,
            "required": ["title"],
            "properties": {
                "title": { "type": "string" },
                "description": { "type": "string" }
            }
        },
        "itemSetList": {
            "type": "array",
            "items": {
                "oneOf": [
                    { "$ref": "#/$defs/itemSet" },
                    { "$ref": "#/$defs/reference" }
                ]
            }
        },

        "media": {
            "type": "object",
            "additionalProperties": false,
            "required": ["url"],
            "properties": {
                "type": { "type": "string", "enum": ["url"] },
                "url": { "type": "string", "format": "uri-reference" },
                "title": { "type": "string" },
                "altText": { "type": "string" }
            }
        },
        "item": {
            "type": "object",
            "additionalProperties": false,
            "required": ["title"],
            "properties": {
                "title": { "type": "string" },
                "description": { "type": "string" },
                "creator": { "type": "string" },
                "itemSets": { "type": "array", "items": { "type": "string" } },
                "sites": {
                    "type": "array",
                    "description": "Slugs (or titles) of the sites this item is assigned to. Defaults to the default site.",
                    "items": { "type": "string" }
                },
                "media": { "type": "array", "items": { "$ref": "#/$defs/media" } }
            }
        },
        "itemList": {
            "type": "array",
            "items": {
                "oneOf": [
                    { "$ref": "#/$defs/item" },
                    { "$ref": "#/$defs/reference" }
                ]
            }
        },

        "sitePermission": {
            "type": "object",
            "additionalProperties": false,
            "required": ["user"],
            "properties": {
                "user": { "type": "string", "description": "Email of an existing blueprint user." },
                "role": { "type": "string", "enum": ["viewer", "editor", "admin"] }
            }
        },
        "site": {
            "type": "object",
            "additionalProperties": false,
            "required": ["title"],
            "properties": {
                "title": { "type": "string" },
                "slug": { "type": "string" },
                "summary": { "type": "string" },
                "theme": { "$ref": "#/$defs/themeId" },
                "isPublic": { "type": "boolean" },
                "setAsDefault": { "type": "boolean" },
                "permissions": {
                    "type": "array",
                    "description": "Per-site user permissions, by user email.",
                    "items": { "$ref": "#/$defs/sitePermission" }
                }
            }
        }
    }
}