{
  "$schema": "../../assets/schema/blueprint-schema.json",
  "meta": {
    "title": "Default Omeka S Playground Blueprint",
    "author": "omeka-s-playground",
    "description": "Baseline browser blueprint for Omeka S Playground."
  },
  "preferredVersions": {
    "php": "8.3",
    "omeka": "4.2.1"
  },
  "debug": {
    "enabled": false
  },
  "landingPage": "/admin",
  "siteOptions": {
    "title": "Omeka S Playground",
    "locale": "en_US",
    "timezone": "UTC"
  },
  "login": {
    "email": "admin@example.com",
    "password": "password"
  },
  "users": [
    {
      "username": "admin",
      "email": "admin@example.com",
      "password": "password",
      "role": "global_admin",
      "isActive": true
    }
  ],
  "themes": [],
  "modules": [],
  "itemSets": [
    {
      "title": "Playground Collection",
      "description": "Default collection created from the browser blueprint."
    }
  ],
  "items": [
    {
      "title": "The Garden of Earthly Delights",
      "description": "Public domain sample item created automatically from the default blueprint.",
      "creator": "Hieronymus Bosch",
      "itemSets": [
        "Playground Collection"
      ],
      "media": [
        {
          "type": "url",
          "url": "./assets/samples/garden-of-earthly-delights.png",
          "title": "The Garden of Earthly Delights"
        }
      ]
    },
    {
      "title": "Thomas Carlyle Oil Painting 1868",
      "description": "Public domain sample item bundled with the default blueprint.",
      "creator": "George Frederic Watts",
      "itemSets": [
        "Playground Collection"
      ],
      "media": [
        {
          "type": "url",
          "url": "./assets/samples/thomas-carlyle-oil-painting-1868.jpg",
          "title": "Thomas Carlyle Oil Painting 1868"
        }
      ]
    },
    {
      "title": "Beethoven Sample Audio",
      "description": "Public domain Beethoven recording bundled with the playground sample blueprint.",
      "creator": "Ludwig van Beethoven",
      "itemSets": [
        "Playground Collection"
      ],
      "media": [
        {
          "type": "url",
          "url": "./assets/samples/beethoven-public-domain.ogg",
          "title": "Public domain Beethoven recording"
        }
      ]
    }
  ],
  "site": {
    "title": "Omeka S Playground Site",
    "slug": "playground",
    "theme": "default",
    "summary": "Default public site created from the browser blueprint.",
    "isPublic": true,
    "setAsDefault": true
  }
}
